{
  "schemaVersion": "1.0.0",
  "contributor": {
    "handle": "ccflex-seed",
    "displayName": "Lourens Cornelius Scheepers (V>>) — seeded 2026-05-19",
    "url": "https://codetonight-sa.github.io/ccflex-skibidi"
  },
  "source": {
    "tool": "claude-code",
    "command": "/stats+/usage",
    "window": {
      "days": 105
    }
  },
  "stats": {
    "favoriteModel": "Opus 4.7",
    "totalTokens": {
      "value": 270700000,
      "display": "270.7m",
      "exact": false
    },
    "sessions": {
      "value": 1021,
      "display": "1,021",
      "exact": true
    },
    "activeDays": {
      "active": 82,
      "of": 105
    },
    "streak": {
      "currentDays": 5,
      "longestDays": 20
    },
    "longestSessionMinutes": 12788,
    "peakHour": {
      "startHour": 23,
      "endHour": 24
    },
    "funFacts": [
      {
        "id": "tokens-vs-harry-potter",
        "label": "more tokens than Harry Potter and the Philosopher's Stone",
        "value": 2627,
        "approx": true,
        "baseline": "Harry Potter book 1"
      }
    ]
  },
  "integrity": {
    "algo": "sha256",
    "canonicalization": "rfc8785",
    "hash": "0a241685547ba45a53dba20411754037e174a78760960f5576a1c8bab841ec3d"
  }
}
